{
  "schema_version": 1,
  "role": "DURABLE_AUTONOMOUS_CONTINUATION_MULTI_SESSION_HANDOFF_RECORD",
  "record_state": "PERSISTED_HINT_ONLY",
  "session_sequence": 1,
  "session_id": "PNCC-SESSION-WU117-MULTI-SESSION-A1",
  "checkpoint_id": "PNCC-CONTINUATION-CHECKPOINT-WU117-CLEAN-A1",
  "checkpoint_blob_sha": "0d5ca65a4fe9711c07aec162c18c4ffde151fafd",
  "previous_checkpoint_id": "PNCC-CONTINUATION-CHECKPOINT-WU115-CLEAN-A1",
  "retained_historical_checkpoint_ids": [
    "PNCC-CONTINUATION-CHECKPOINT-WU115-CLEAN-A1"
  ],
  "handoff_class": "CLEAN_ITERATION_BOUNDARY",
  "recorded_main_sha": "daa77dc4a263ba9d8f9a185d134bdc4ceae5bcad",
  "selected_work_unit": {
    "work_unit_id": "PIPE-WU-117",
    "issue_number": 282,
    "base_sha": "daa77dc4a263ba9d8f9a185d134bdc4ceae5bcad",
    "runtime_required": false,
    "provider_open": true
  },
  "provider_state": {
    "state_branch_head_sha": "c7d21af6f8fa87cd3336c3caad8d21717130a6da",
    "registry_blob_sha": "1c2c7523e2ec8f225dc356caef679d5a2429ebc5",
    "registry_generation": 25
  },
  "execution_state": {
    "lease_state": "ACTIVE",
    "lease_id": "4d1d6f58-0376-4ad5-88f6-5c9d16aceb71",
    "branch_name": "agent/PIPE-WU-117-durable-autonomous-continuation-multi-session-steady-state",
    "branch_head_sha": "daa77dc4a263ba9d8f9a185d134bdc4ceae5bcad",
    "pull_request_state": "NONE",
    "pull_request_number": null,
    "ci_state": "NONE",
    "ci_head_sha": null
  },
  "last_completed_iteration": 2,
  "provider_readback_completed": true,
  "persisted_decisions": {
    "control_loop_decision": "PLAN_EXISTING_BOUNDED_BRANCH_CREATE",
    "execution_admission_decision": "ADMIT_EXISTING_WRITER_LEASE_AUTHORITY",
    "ci_decision": null,
    "merge_eligibility_decision": null
  },
  "checkpoint_is_mutation_authority": false,
  "checkpoint_cas_tokens_reusable": false,
  "checkpoint_ci_success_reusable": false,
  "checkpoint_admission_reusable": false,
  "checkpoint_merge_eligibility_reusable": false,
  "checkpoint_writer_lease_ownership_reusable": false,
  "contains_private_runtime_payload": false,
  "contains_credentials": false,
  "contains_host_identifiers": false,
  "contains_secret_transport_data": false
}
